aangesteld	#	als 2e luitenant bij het 2e regiment Hollandsche ligte dragonders
verlaten	AM-TMP	in 1814
Zie	#	Neerl. heldend. te land , D. III. bl
zijn	#	in dien rang aangesteld te zijn bij het 4e regiment Nederlandsche ligte dragonders
onderscheiden	ArgM-REC	zich
overgeplaatst	Arg1	met het Fransche keizerrijk , in fransche dienst
stierf	AM-TMP	na in 1814 als ritmeester het Fransche leger eervol te hebben verlaten , en in dien rang aangesteld te zijn bij het 4e regiment Nederlandsche ligte dragonders
vermeesteren	Arg1	een stuk vijandelijk geschut
